{"business_unit":"unreal-media-group","campaign_name":"UMG Fitness and Activewear","discovery_scope":"filtered","verticals":["fitness","activewear"],"geography":{"countries":["United States"]},"buyer_types":["brand"],"talent_categories":[],"target_prospect_count":20,"deep_research_limit":8,"minimum_qualification_score":72,"required_signals":["current marketing activity"],"preferred_signals":["product launch","creator content"],"excluded_categories":["unsafe supplements"],"include_companies":[],"exclude_companies":["Synthetic Existing Client"],"reengagement_enabled":false,"cooldown_days":120,"maximum_evidence_age_days":120,"output_formats":["json","markdown","html"],"prospect_history_path":"../history/prospect-history.json","allow_named_talent_recommendations":false}
