{
  "business_unit": "unreal-media-group",
  "campaign_name": "UMG Product Photography and Video",
  "discovery_scope": "open",
  "verticals": [],
  "geography": {
    "countries": ["United States"]
  },
  "buyer_types": ["brand"],
  "talent_categories": [],
  "opportunity_filter": {
    "include_any": ["product_photography", "product_video"],
    "exclude": ["ugc_ad"]
  },
  "target_prospect_count": 25,
  "deep_research_limit": 10,
  "minimum_qualification_score": 72,
  "required_signals": ["current product or campaign activity"],
  "preferred_signals": ["product launch", "visual campaign", "ecommerce refresh"],
  "excluded_categories": ["prohibited products"],
  "include_companies": [],
  "exclude_companies": [],
  "reengagement_enabled": false,
  "cooldown_days": 120,
  "maximum_evidence_age_days": 180,
  "output_formats": ["json", "markdown", "html"],
  "prospect_history_path": "../history/starter-prospect-history.json",
  "allow_named_talent_recommendations": false
}
