{"business_unit":"unreal-media-group","campaign_name":"UMG Re-engagement","discovery_scope":"open","verticals":[],"geography":{},"buyer_types":["brand"],"talent_categories":[],"target_prospect_count":10,"deep_research_limit":5,"minimum_qualification_score":72,"required_signals":["materially new dated trigger"],"preferred_signals":[],"excluded_categories":[],"include_companies":[],"exclude_companies":[],"reengagement_enabled":true,"cooldown_days":120,"maximum_evidence_age_days":90,"output_formats":["json","markdown"],"prospect_history_path":"../history/prospect-history.json","allow_named_talent_recommendations":false}
