{"business_unit":"unreal-talent","campaign_name":"Unreal Talent Open Discovery","discovery_scope":"open","verticals":[],"geography":{"countries":["United States"]},"buyer_types":["brand","agency"],"talent_categories":[],"rights_territory":["United States"],"target_prospect_count":15,"deep_research_limit":8,"minimum_qualification_score":78,"required_signals":["current campaign trigger"],"preferred_signals":["professional campaign history"],"excluded_categories":["brand-safety prohibited"],"include_companies":[],"exclude_companies":[],"reengagement_enabled":false,"cooldown_days":180,"maximum_evidence_age_days":180,"output_formats":["json","markdown","html"],"prospect_history_path":"../history/prospect-history.json","approved_roster_path":null,"allow_named_talent_recommendations":false}
