{"business_unit":"unreal-media-group","campaign_name":"UMG Open Discovery","discovery_scope":"open","verticals":[],"geography":{"countries":["United States"]},"buyer_types":["brand"],"talent_categories":[],"target_prospect_count":25,"deep_research_limit":10,"minimum_qualification_score":72,"required_signals":["active business presence"],"preferred_signals":["recent launch","active paid social"],"excluded_categories":["prohibited products"],"include_companies":[],"exclude_companies":[],"reengagement_enabled":false,"cooldown_days":120,"maximum_evidence_age_days":180,"output_formats":["json","markdown","html"],"prospect_history_path":"../history/prospect-history.json","allow_named_talent_recommendations":false}
