{"business_unit":"unreal-media-group","campaign_name":"UMG Apparel","discovery_scope":"filtered","verticals":["apparel"],"geography":{},"buyer_types":["brand"],"talent_categories":[],"target_prospect_count":15,"deep_research_limit":6,"minimum_qualification_score":72,"required_signals":["visual product"],"preferred_signals":["seasonal collection"],"excluded_categories":[],"include_companies":[],"exclude_companies":[],"reengagement_enabled":false,"cooldown_days":120,"maximum_evidence_age_days":180,"output_formats":["json","markdown"],"prospect_history_path":"../history/prospect-history.json","allow_named_talent_recommendations":false}
