{"business_unit":"unreal-talent","campaign_name":"Unreal Talent Agencies","discovery_scope":"open","verticals":[],"geography":{"countries":["United States"]},"buyer_types":["agency"],"talent_categories":[],"rights_territory":["United States"],"target_prospect_count":10,"deep_research_limit":5,"minimum_qualification_score":78,"required_signals":["new account or production need"],"preferred_signals":["talent campaign experience"],"excluded_categories":[],"include_companies":[],"exclude_companies":[],"reengagement_enabled":false,"cooldown_days":180,"maximum_evidence_age_days":180,"output_formats":["json","markdown","html"],"prospect_history_path":"../history/prospect-history.json","approved_roster_path":null,"allow_named_talent_recommendations":false}
