{"business_unit":"unreal-talent","campaign_name":"Unreal Talent Sports Brands","discovery_scope":"filtered","verticals":["sports apparel","sports beverage"],"geography":{"countries":["United States"]},"buyer_types":["brand"],"talent_categories":["athlete"],"rights_territory":["United States"],"target_prospect_count":12,"deep_research_limit":6,"minimum_qualification_score":78,"required_signals":["active launch or partnership"],"preferred_signals":["existing athlete marketing"],"excluded_categories":["rights conflict"],"include_companies":[],"exclude_companies":[],"reengagement_enabled":false,"cooldown_days":180,"maximum_evidence_age_days":120,"output_formats":["json","markdown","html"],"prospect_history_path":"../history/prospect-history.json","approved_roster_path":null,"allow_named_talent_recommendations":false}
